{
  "artifact_id": "urn:riopa:artifact:sha256:bbbbbbbbbbbbbbbbbbbbbbbbbbbbbbbbbbbbbbbbbbbbbbbbbbbbbbbbbbbbbbbb",
  "logical_id": "urn:riopa:example:linz-layer-canonical",
  "path": "data/canonical/example-layer.parquet",
  "uri": null,
  "sha256": "bbbbbbbbbbbbbbbbbbbbbbbbbbbbbbbbbbbbbbbbbbbbbbbbbbbbbbbbbbbbbbbb",
  "size_bytes": 768,
  "media_type": "application/vnd.apache.parquet",
  "created_at": "2026-07-18T01:06:00Z",
  "source_id": null,
  "schema_id": "https://w3id.org/riopa/example/spatial-layer/v1",
  "rights_ref": "rights-inventory.json#linz",
  "preservation_ref": null,
  "payload_status": "not-bundled",
  "verification_status": "synthetic-placeholder"
}
